[
  {
    "id": "neolitico",
    "term": "Neolítico",
    "definition": "Periodo en el que distintas comunidades comenzaron a depender de la agricultura y la ganadería, a vivir de forma más estable y a transformar profundamente su relación con plantas, animales y territorio. No ocurrió al mismo tiempo en todas las regiones.",
    "status": "reviewed"
  },
  {
    "id": "calcolitico",
    "term": "Calcolítico",
    "definition": "Etapa de transición en la que empiezan a utilizarse objetos de cobre mientras las herramientas de piedra siguen siendo habituales. Sus fechas cambian según la región.",
    "status": "reviewed"
  },
  {
    "id": "natufiense",
    "term": "Natufiense",
    "definition": "Conjunto de comunidades de cazadores-recolectores del Levante, aproximadamente entre 12.500 y 9.500 a. C., algunas de ellas con asentamientos relativamente estables antes de la agricultura plenamente desarrollada.",
    "status": "reviewed"
  },
  {
    "id": "arqueobotanica",
    "term": "arqueobotánica",
    "definition": "Estudio de restos vegetales recuperados en contextos arqueológicos: semillas, frutos, tejidos, madera, polen, almidones o alimentos carbonizados.",
    "status": "reviewed"
  },
  {
    "id": "biomarcador",
    "term": "biomarcador",
    "definition": "Molécula o combinación de moléculas que ayuda a identificar una sustancia antigua. Un biomarcador rara vez debe interpretarse aislado del contexto arqueológico.",
    "status": "reviewed"
  },
  {
    "id": "gc_ms",
    "term": "GC-MS",
    "definition": "Cromatografía de gases acoplada a espectrometría de masas. Separa una mezcla química y ayuda a identificar sus componentes por su firma molecular.",
    "status": "reviewed"
  },
  {
    "id": "lc_ms_ms",
    "term": "LC-MS/MS",
    "definition": "Cromatografía líquida acoplada a espectrometría de masas en tándem. Permite buscar compuestos concretos en cantidades muy pequeñas.",
    "status": "reviewed"
  },
  {
    "id": "sem",
    "term": "SEM",
    "definition": "Microscopía electrónica de barrido. Produce imágenes de gran aumento de la superficie y microestructura de un material, útil para estudiar tejidos vegetales y poros en restos alimentarios carbonizados.",
    "status": "reviewed"
  },
  {
    "id": "dendrocronologia",
    "term": "dendrocronología",
    "definition": "Datación mediante los anillos de crecimiento de la madera. Cuando las secuencias están bien conservadas y existe una cronología de referencia, puede alcanzar una resolución extraordinariamente precisa.",
    "status": "reviewed"
  },
  {
    "id": "tell",
    "term": "tell",
    "definition": "Montículo arqueológico formado por la acumulación de sucesivas ocupaciones humanas, construcciones, derrumbes y rellenos durante largos periodos.",
    "status": "reviewed"
  },
  {
    "id": "chaine_operatoire",
    "term": "chaîne opératoire",
    "definition": "Expresión arqueológica para describir la secuencia completa de acciones técnicas: selección de materias primas, preparación, transformación, uso y descarte.",
    "status": "reviewed"
  },
  {
    "id": "assize",
    "term": "assize",
    "definition": "Sistema medieval de reglas y controles sobre productos y mercados. En el caso del pan inglés, regulaba aspectos como peso, precio y venta.",
    "status": "reviewed"
  },
  {
    "id": "fermentacion_en_masa",
    "term": "fermentación en masa",
    "definition": "Periodo de reposo de toda la masa antes de dividirla y darle forma. En panificación tradicional puede durar horas y contribuye al desarrollo de la masa.",
    "status": "reviewed"
  },
  {
    "id": "pasteurizacion",
    "term": "pasteurización",
    "definition": "Tratamiento térmico destinado a reducir microorganismos y mejorar la conservación. El nombre deriva de Pasteur, aunque el uso del calor para conservar alimentos es anterior.",
    "status": "reviewed"
  },
  {
    "id": "fermentacion",
    "term": "fermentación",
    "definition": "Transformación bioquímica en la que microorganismos y sus enzimas metabolizan componentes de un alimento o bebida. En alimentación incluye procesos diversos —alcohólicos, lácticos y otros— y no equivale por sí sola a conservación o inocuidad.",
    "status": "reviewed"
  },
  {
    "id": "edad_del_bronce",
    "term": "Edad del Bronce",
    "definition": "Periodo histórico definido por el uso generalizado de aleaciones de cobre, especialmente bronce, junto con cambios sociales y económicos que varían mucho según la región. No tiene las mismas fechas en todo el mundo.",
    "status": "reviewed"
  },
  {
    "id": "levadura",
    "term": "levadura",
    "definition": "Hongo unicelular. Determinadas especies y cepas participan en fermentaciones alimentarias, por ejemplo transformando azúcares en etanol, dióxido de carbono y otros metabolitos.",
    "status": "reviewed"
  },
  {
    "id": "bacterias_acido_lacticas",
    "term": "bacterias ácido-lácticas",
    "definition": "Grupo funcional de bacterias que producen ácido láctico como metabolito relevante a partir de azúcares y participan en numerosas fermentaciones de alimentos.",
    "status": "reviewed"
  },
  {
    "id": "cultivo_puro",
    "term": "cultivo puro",
    "definition": "Cultivo obtenido a partir de una población microbiológica aislada y propagada bajo condiciones controladas. Históricamente permitió estudiar y reproducir con mayor precisión microorganismos concretos.",
    "status": "reviewed"
  },
  {
    "id": "cultivo_iniciador",
    "term": "cultivo iniciador / starter",
    "definition": "Preparación de microorganismos seleccionados que se inocula para iniciar y orientar una fermentación de manera más controlada y reproducible.",
    "status": "reviewed"
  },
  {
    "id": "theobromine",
    "term": "teobromina",
    "definition": "Alcaloide metilxantínico abundante en el cacao. En arqueología puede servir como marcador químico útil cuando se interpreta junto con contexto y otras líneas de evidencia; por sí solo no reconstruye una receta.",
    "status": "reviewed"
  },
  {
    "id": "cocoa_butter",
    "term": "manteca de cacao",
    "definition": "Fracción grasa natural del cacao. Su separación mediante prensado permite obtener tortas de cacao con menor contenido graso y, a la vez, una grasa que puede reincorporarse en formulaciones de chocolate.",
    "status": "reviewed"
  },
  {
    "id": "conching",
    "term": "conchado",
    "definition": "Etapa de elaboración del chocolate basada en trabajo mecánico prolongado de la masa, normalmente con mezcla, cizallamiento, aireación y control térmico, que modifica textura, humedad, compuestos volátiles y propiedades de flujo.",
    "status": "reviewed"
  },
  {
    "id": "coffea_arabica",
    "term": "Coffea arabica",
    "definition": "Especie de cafeto tetraploide originaria de bosques montanos del África oriental, con su mayor diversidad genética en Etiopía. Su origen botánico no equivale a la fecha o lugar de invención de la bebida de café.",
    "status": "reviewed"
  },
  {
    "id": "coffeehouse",
    "term": "coffeehouse / casa de café",
    "definition": "Establecimiento urbano dedicado al consumo de café y a la sociabilidad. Según época y lugar podía funcionar como espacio de conversación, información, entretenimiento, negocios o intercambio intelectual.",
    "status": "reviewed"
  },
  {
    "id": "espresso",
    "term": "espresso",
    "definition": "Método de preparación de café basado en hacer pasar agua caliente a presión a través de café finamente molido y compactado. No es una especie de café ni un grado de tueste, y su forma contemporánea surgió por una secuencia de innovaciones técnicas.",
    "status": "reviewed"
  },
  {
    "id": "crema_espresso",
    "term": "crema del espresso",
    "definition": "Capa de espuma y emulsión que se forma sobre un espresso extraído a suficiente presión. Se asocia a gases, aceites y compuestos coloidales liberados durante la extracción y se volvió característica con las máquinas de alta presión del siglo XX.",
    "status": "reviewed"
  },
  {
    "id": "sacarosa",
    "term": "sacarosa",
    "definition": "Disacárido formado por glucosa y fructosa. En el uso cotidiano suele corresponder al azúcar de mesa; químicamente es la misma molécula tanto si procede de caña como de remolacha.",
    "status": "reviewed"
  },
  {
    "id": "cana_azucar",
    "term": "caña de azúcar / Saccharum officinarum",
    "definition": "Gramínea tropical domesticada en la región de Nueva Guinea a partir de linajes de S. robustum y seleccionada por tallos ricos en sacarosa. Las variedades modernas son genéticamente más complejas que una única especie pura.",
    "status": "reviewed"
  },
  {
    "id": "cristalizacion_azucar",
    "term": "cristalización del azúcar",
    "definition": "Operación en la que una disolución concentrada de sacarosa forma cristales sólidos. Históricamente permitió transformar jugos y jarabes perecederos en un producto más estable, dosificable y transportable.",
    "status": "reviewed"
  },
  {
    "id": "plantacion_azucarera",
    "term": "plantación azucarera",
    "definition": "Sistema agrario orientado a producir caña a gran escala y conectado con molienda, cocción/refinado y comercio. En el Atlántico moderno estuvo profundamente ligado a colonización, apropiación de tierras y trabajo esclavizado o coercitivo.",
    "status": "reviewed"
  },
  {
    "id": "remolacha_azucarera",
    "term": "remolacha azucarera",
    "definition": "Cultivo de Beta vulgaris seleccionado por alta concentración de sacarosa en la raíz. Desde finales del siglo XVIII y el XIX permitió producir azúcar en regiones templadas donde la caña tropical no era viable.",
    "status": "reviewed"
  },
  {
    "id": "tuberculo",
    "term": "tubérculo",
    "definition": "Órgano vegetal engrosado que almacena reservas. En la patata, los tubérculos son tallos subterráneos modificados; no son raíces, aunque en cocina se agrupen a menudo con otros productos subterráneos.",